{
  "$schema": "https://json-schema.org/draft/2020-12/schema",
  "type": "object",
  "required": [
    "semantic_slots",
    "deltas",
    "verdict",
    "repairs",
    "reviewer",
    "independent_from_formalizer",
    "independent_from_decoder",
    "review_evidence",
    "review_run_sha256",
    "reviewer_packet_sha256"
  ],
  "additionalProperties": false,
  "properties": {
    "semantic_slots": {
      "type": "object",
      "required": [
        "objects",
        "domains",
        "quantifiers",
        "assumptions",
        "conclusion",
        "scopes",
        "constant_dependencies"
      ],
      "additionalProperties": false,
      "properties": {
        "objects": {
          "type": "object",
          "required": [
            "original",
            "reconstructed",
            "relation",
            "evidence"
          ],
          "additionalProperties": false,
          "properties": {
            "original": {
              "type": "string"
            },
            "reconstructed": {
              "type": "string"
            },
            "relation": {
              "type": "string"
            },
            "evidence": {
              "type": "string"
            }
          }
        },
        "domains": {
          "type": "object",
          "required": [
            "original",
            "reconstructed",
            "relation",
            "evidence"
          ],
          "additionalProperties": false,
          "properties": {
            "original": {
              "type": "string"
            },
            "reconstructed": {
              "type": "string"
            },
            "relation": {
              "type": "string"
            },
            "evidence": {
              "type": "string"
            }
          }
        },
        "quantifiers": {
          "type": "object",
          "required": [
            "original",
            "reconstructed",
            "relation",
            "evidence"
          ],
          "additionalProperties": false,
          "properties": {
            "original": {
              "type": "string"
            },
            "reconstructed": {
              "type": "string"
            },
            "relation": {
              "type": "string"
            },
            "evidence": {
              "type": "string"
            }
          }
        },
        "assumptions": {
          "type": "object",
          "required": [
            "original",
            "reconstructed",
            "relation",
            "evidence"
          ],
          "additionalProperties": false,
          "properties": {
            "original": {
              "type": "string"
            },
            "reconstructed": {
              "type": "string"
            },
            "relation": {
              "type": "string"
            },
            "evidence": {
              "type": "string"
            }
          }
        },
        "conclusion": {
          "type": "object",
          "required": [
            "original",
            "reconstructed",
            "relation",
            "evidence"
          ],
          "additionalProperties": false,
          "properties": {
            "original": {
              "type": "string"
            },
            "reconstructed": {
              "type": "string"
            },
            "relation": {
              "type": "string"
            },
            "evidence": {
              "type": "string"
            }
          }
        },
        "scopes": {
          "type": "object",
          "required": [
            "original",
            "reconstructed",
            "relation",
            "evidence"
          ],
          "additionalProperties": false,
          "properties": {
            "original": {
              "type": "string"
            },
            "reconstructed": {
              "type": "string"
            },
            "relation": {
              "type": "string"
            },
            "evidence": {
              "type": "string"
            }
          }
        },
        "constant_dependencies": {
          "type": "object",
          "required": [
            "original",
            "reconstructed",
            "relation",
            "evidence"
          ],
          "additionalProperties": false,
          "properties": {
            "original": {
              "type": "string"
            },
            "reconstructed": {
              "type": "string"
            },
            "relation": {
              "type": "string"
            },
            "evidence": {
              "type": "string"
            }
          }
        }
      }
    },
    "deltas": {
      "type": "array"
    },
    "repairs": {
      "type": "array"
    },
    "verdict": {
      "type": "string"
    },
    "reviewer": {
      "type": "string"
    },
    "review_evidence": {
      "type": "string"
    },
    "review_run_sha256": {
      "type": "string"
    },
    "reviewer_packet_sha256": {
      "type": "string"
    },
    "independent_from_formalizer": {
      "type": "boolean"
    },
    "independent_from_decoder": {
      "type": "boolean"
    }
  }
}
