{
  "semantic_slots": {
    "objects": {
      "original": "Actual rho from indexed Diracs, scalar-integral predictor, actual loss and selected L2 classes.",
      "reconstructed": "Same finite law and literal predictor evaluated at every data point.",
      "relation": "equivalent",
      "evidence": "Fresh sourcepin source, anonymous reconstruction and full-module lines95-124 independently compared. Proof108-117 independently normalizes actual mass and evaluates Dirac integrals;118-124 consumes the genuine finite L2 residual theorem. Lesson steps1-3 match this order and its required inputs."
    },
    "domains": {
      "original": "Measurable W with measurable singletons, measurable Omega, arbitrary P, positive N.",
      "reconstructed": "Same structures and arbitrary data measure; no mass restriction on P.",
      "relation": "explicit-elaboration",
      "evidence": "Fresh sourcepin source, anonymous reconstruction and full-module lines95-124 independently compared. Proof108-117 independently normalizes actual mass and evaluates Dirac integrals;118-124 consumes the genuine finite L2 residual theorem. Lesson steps1-3 match this order and its required inputs."
    },
    "quantifiers": {
      "original": "Every indexed configuration, arbitrary kernel and label with only selected slices L2; values may collide.",
      "reconstructed": "No injectivity or nonsampled-feature membership; repeated atoms retain multiplicity.",
      "relation": "equivalent",
      "evidence": "Fresh sourcepin source, anonymous reconstruction and full-module lines95-124 independently compared. Proof108-117 independently normalizes actual mass and evaluates Dirac integrals;118-124 consumes the genuine finite L2 residual theorem. Lesson steps1-3 match this order and its required inputs."
    },
    "assumptions": {
      "original": "N>0, measurable singleton points, selected slice and label L2 inputs.",
      "reconstructed": "Identical; no global measurability in q or supplied predictor identity.",
      "relation": "equivalent",
      "evidence": "Fresh sourcepin source, anonymous reconstruction and full-module lines95-124 independently compared. Proof108-117 independently normalizes actual mass and evaluates Dirac integrals;118-124 consumes the genuine finite L2 residual theorem. Lesson steps1-3 match this order and its required inputs."
    },
    "conclusion": {
      "original": "rho probability, actual scalar loss integrable, integral equals displayed squared L2 class norm.",
      "reconstructed": "All three conclusions; pointwise predictor evaluation correctly describes the internal derived identity.",
      "relation": "equivalent",
      "evidence": "Fresh sourcepin source, anonymous reconstruction and full-module lines95-124 independently compared. Proof108-117 independently normalizes actual mass and evaluates Dirac integrals;118-124 consumes the genuine finite L2 residual theorem. Lesson steps1-3 match this order and its required inputs."
    },
    "scopes": {
      "original": "Finite atomic assertion with arbitrary data measure, averaged predictor before loss.",
      "reconstructed": "A.e. quotient representatives are distinguished from pointwise finite Dirac evaluation; no general parameter-law integration claim.",
      "relation": "explicit-elaboration",
      "evidence": "Fresh sourcepin source, anonymous reconstruction and full-module lines95-124 independently compared. Proof108-117 independently normalizes actual mass and evaluates Dirac integrals;118-124 consumes the genuine finite L2 residual theorem. Lesson steps1-3 match this order and its required inputs."
    },
    "constant_dependencies": {
      "original": "ENNReal reciprocalN normalizes N Diracs; real reciprocalN scales their predictor/class sums.",
      "reconstructed": "Exactly those weights and no missing collision multiplicity.",
      "relation": "equivalent",
      "evidence": "Fresh sourcepin source, anonymous reconstruction and full-module lines95-124 independently compared. Proof108-117 independently normalizes actual mass and evaluates Dirac integrals;118-124 consumes the genuine finite L2 residual theorem. Lesson steps1-3 match this order and its required inputs."
    }
  },
  "deltas": [],
  "verdict": "equivalent-after-elaboration",
  "repairs": [],
  "reviewer": "independent-quadratic-feature-risk-sourcepin-reviewer",
  "independent_from_formalizer": true,
  "independent_from_decoder": true,
  "review_evidence": "Fresh immutable-source-pin review of ASTIS-REVIEW-4508e28d81fb33af. Only the six fresh sourcepin packets, permitted old anti-anchored packets for mechanical diff, and the exact local immutable authored-source git object were used; no earlier review-result verdict was read or copied. Exact old/new JSON diff is limited to candidate_publication_context.source.url, publication_binding_sha256 and packet_sha256. Sources, scoped signatures, complete393-line embedded public module, blind decoder texts/inputs/results and complete lessons are unchanged. They were independently checked for the seven slots, full assumptions, formula proofs and generic scope: Proof108-117 independently normalizes actual mass and evaluates Dirac integrals;118-124 consumes the genuine finite L2 residual theorem. Lesson steps1-3 match this order and its required inputs. Source SHA256=c5c048b3dc74cd0d8ca014bf954357035297ce11bc6158bb6b25ccc40551a6b0; signature SHA256=4556baed50fd8e4df4bf7b4d1b26440c8f29b9a403964eda9a2f950f0b4a1632; blind reconstruction SHA256=e1f324c86b734be522bb113b738e7501ef1493d53a31ee42e9c0ac85f104d090; each independently recomputed. Whole-module UTF-8 SHA256=d6e59905c1ba0412ed3549ae24408ab749ad807cb554892ef91d06eb39ddb987 matches its content, and declaration extraction with only name anonymization matches the packet signature. Canonical fresh packet SHA256 verified=855c4b01001a3bfca3e1772dccc27cb5ca577df5913093531d1da4923adb6c42; packet raw SHA256=e46ef3b7cd4817bd1ba34b9ca9ff4a51701be4e5a6427b2d9b99c2d485722226. Full publication context is covered by that verified packet, with independent canonical content SHA256=b28208452eb4afc0df2b4eb4cbf990bb9e5250930fe16cfacc665cf897a22881. Opaque declared publication_binding_sha256=552ec6b5e116da537378347a8f9a5878d360dbe5066bce5c4acbaab186c9a285 is retained, not separately rebuilt from omitted metadata. New attribution URL target is the repository-relative immutable blob/2ffa3a13e278031a129d08a7fa07277da7883713/website/content/declaration_lessons/quadratic-feature-risk.json. Executed read-only git show 2ffa3a13e278031a129d08a7fa07277da7883713:website/content/declaration_lessons/quadratic-feature-risk.json; the local object is a valid commit, authored-source Git blob=b99ed88b3d4a57a900d249ad6f933528ec357eb9, raw source-file SHA256=ab906d6c79579fba04d095423d9bfc42de413b94d90b9d26420d50dc0172e5bd. Its corresponding authored lesson object, after omitting only the boundary field deliberately absent from reviewer context, exactly equals this complete packet lesson; its canonical content SHA256=9ca75a3d1b0d5e337caff7cef898034c3378138f727f2d0f47bfb31f83f37ccc. This verifies the pinned source statement/formula/assumptions/proof-steps/dependency/attribution projection. Omitted boundary classification is not used to infer a verdict. Existing nested historical lesson links remain unchanged; this review concerns the primary immutable attribution pin and does not assert every URL is pinned. Local git object verification is not a claim that the not-yet-pushed commit URL has been remotely fetched or is already publicly reachable. Source is a library-authored original mathematical supplement, not a book theorem or stochastic convergence attribution. No new mathematical, original-model, global first-variation or full-model credit is awarded by the URL change. No compiler/gate/site run, source/ledger/cell edit or push was performed. Packet inputs and immutable source bytes stayed unchanged before writing these new results. Exact canonical output_contract preserved; self review_run_sha256 uses sorted compact UTF-8 JSON ensure_ascii=false excluding its own field; output bytes use UTF-8 with LF.",
  "reviewer_packet_sha256": "855c4b01001a3bfca3e1772dccc27cb5ca577df5913093531d1da4923adb6c42",
  "review_run_sha256": "a3529114f3e253ec77526aca1fc656cc1f3a11233a3e3cfb01bfd40a4455f478"
}
