{
  "semantic_slots": {
    "objects": {
      "original": "Fixed real inner-product vectors a,y,v, moving phi, time t, positive N and arbitrary real lambda; literal unscaled/scaled risks.",
      "reconstructed": "The same data with r(s)=n^(-1)(a+phi(s))-y and n the real cast.",
      "relation": "equivalent",
      "evidence": "Fresh allpins source/signature/blind comparison; complete module lines31-60. Differentiating phi produces the actual residual derivative v/N. The norm-square rule supplies2/N; constant risk scaling cancels N using hN, including the valid algebraic lambda0 case. All three lesson proof steps match."
    },
    "domains": {
      "original": "Real inner-product normed H, without completeness, with N>0 and totalized real division.",
      "reconstructed": "Same structures and domains; lambda may be0 or negative, N may not be0.",
      "relation": "explicit-elaboration",
      "evidence": "Fresh allpins source/signature/blind comparison; complete module lines31-60. Differentiating phi produces the actual residual derivative v/N. The norm-square rule supplies2/N; constant risk scaling cancels N using hN, including the valid algebraic lambda0 case. All three lesson proof steps match."
    },
    "quantifiers": {
      "original": "Every displayed fixed parameter set and local feature derivative yield both risk derivatives at the same t.",
      "reconstructed": "Universal parameters with only s varying and both derivative statements asserted together.",
      "relation": "equivalent",
      "evidence": "Fresh allpins source/signature/blind comparison; complete module lines31-60. Differentiating phi produces the actual residual derivative v/N. The norm-square rule supplies2/N; constant risk scaling cancels N using hN, including the valid algebraic lambda0 case. All three lesson proof steps match."
    },
    "assumptions": {
      "original": "The actual derivative of phi is v at t, and N>0.",
      "reconstructed": "Exactly these analytic/cardinality premises, not either desired risk derivative.",
      "relation": "equivalent",
      "evidence": "Fresh allpins source/signature/blind comparison; complete module lines31-60. Differentiating phi produces the actual residual derivative v/N. The norm-square rule supplies2/N; constant risk scaling cancels N using hN, including the valid algebraic lambda0 case. All three lesson proof steps match."
    },
    "conclusion": {
      "original": "Derivatives(2/N)*inner(r(t),v) and(2/lambda)*inner(r(t),v) for the two functions.",
      "reconstructed": "Both exact formulas and evaluation times are retained.",
      "relation": "equivalent",
      "evidence": "Fresh allpins source/signature/blind comparison; complete module lines31-60. Differentiating phi produces the actual residual derivative v/N. The norm-square rule supplies2/N; constant risk scaling cancels N using hN, including the valid algebraic lambda0 case. All three lesson proof steps match."
    },
    "scopes": {
      "original": "Local scalar-parameter calculus; lambda0 is algebraic scaling, not a physical temperature conclusion.",
      "reconstructed": "No global differentiability, completeness, geometric or stochastic assertion.",
      "relation": "explicit-elaboration",
      "evidence": "Fresh allpins source/signature/blind comparison; complete module lines31-60. Differentiating phi produces the actual residual derivative v/N. The norm-square rule supplies2/N; constant risk scaling cancels N using hN, including the valid algebraic lambda0 case. All three lesson proof steps match."
    },
    "constant_dependencies": {
      "original": "Unhalved factor2, actual mean1/N and constant multiplierN/lambda.",
      "reconstructed": "Identical factors; only N is cancelled and no nonzero-lambda assumption enters.",
      "relation": "equivalent",
      "evidence": "Fresh allpins source/signature/blind comparison; complete module lines31-60. Differentiating phi produces the actual residual derivative v/N. The norm-square rule supplies2/N; constant risk scaling cancels N using hN, including the valid algebraic lambda0 case. All three lesson proof steps match."
    }
  },
  "deltas": [],
  "verdict": "equivalent-after-elaboration",
  "repairs": [],
  "reviewer": "independent-quadratic-feature-risk-allpins-reviewer",
  "independent_from_formalizer": true,
  "independent_from_decoder": true,
  "review_evidence": "Independent current-binding allpins source review for ASTIS-REVIEW-9d1005ed2efe14ea. Used only the six new anti-anchored packets, permitted old sourcepin.review packets for mechanical source-data comparison, and git show of the fixed authored-source commit; no earlier result verdict was read or copied. Every packet delta is exactly lesson.sources[0].url plus the recomputed publication_binding_sha256 and packet_sha256. Primary publication source URL was already fixed and remains unchanged. All six current primary/source citations target repository-relative blob/2ffa3a13e278031a129d08a7fa07277da7883713/website/content/declaration_lessons/quadratic-feature-risk.json. The complete393-line module, six mathematical source statements/formulas/assumptions, all23 lesson proof steps, signatures and complete blind decoder objects are unchanged. Full scoped signature extraction with only declaration-name anonymization independently matches this fresh packet; module SHA256=d6e59905c1ba0412ed3549ae24408ab749ad807cb554892ef91d06eb39ddb987 is independently recomputed. This interface was mathematically compared in all seven slots: Differentiating phi produces the actual residual derivative v/N. The norm-square rule supplies2/N; constant risk scaling cancels N using hN, including the valid algebraic lambda0 case. All three lesson proof steps match. Source-text SHA256=1a12e82f90cff876d8aa5a8a05443096e1142b2a0eee89195676bbeb9133090c; statement SHA256=fb085461788f3f69a6601b0798cf4ad2c616d06fcd7c4963d7f08471c6f06a59; blind-text SHA256=f3d3cbf8b65ea338da88a0f9270722a5a88e5c106ada1ea16b21ac8080dcef90; each recomputed. Verified canonical allpins packet SHA256=916991a99e70c8e8033b09a6088a93a0293552c7e59cf99047b62fa45d756135; raw packet SHA256=78439ec35ab3434419ff632906602ab3391527ab68a4cdfc8e04b047616f3946. Current complete lesson canonical SHA256=bcaf711093b9409ef84f9615a977767015c68308c3bbdfa4a4d56fc1ae84d8c9 and review-context canonical SHA256=58795ba10f6b49daedc646ab51c41d71a343d3e8b97334316ea4d35df2a7ade4 are independently computed and covered by that packet. Opaque declared publication binding=1d4c271acc6e4c7449fbc2b2e5413c62dd1246720abceaf4979313cf019aaac3 is retained rather than reconstructed from omitted metadata. Read-only git show 2ffa3a13e278031a129d08a7fa07277da7883713:website/content/declaration_lessons/quadratic-feature-risk.json verified local immutable authored-source blob b99ed88b3d4a57a900d249ad6f933528ec357eb9, raw file SHA256=ab906d6c79579fba04d095423d9bfc42de413b94d90b9d26420d50dc0172e5bd. Comparing its matching authored unit with the fresh lesson is exact after ignoring only sources URL fields and the boundary field deliberately omitted from reviewer packets; every mathematical and proof-step field remains equal. Boundary metadata was not used as a verdict. This is a library-authored original mathematical supplement, not attribution to a book convergence theorem. The immutable citation correction gives no new model, Gaussian, global first-variation, spatial or convergence credit. The citation audit is limited to the six current authored interfaces; it is not a whole-repository or historical URL/privacy inventory. Local Git object verification makes no remote availability/push assertion. Source-report inventory and final root gates were not inspected or certified by this review. No source, old packet/result, ledger, cell, compiler cache or other output was touched; no compilation, site check or push was run. Input packet bytes and immutable source bytes remained stable. Exact canonical output contract is preserved; self review_run_sha256 uses sorted compact UTF-8 JSON ensure_ascii=false excluding its own field. New result bytes use UTF-8 with LF.",
  "reviewer_packet_sha256": "916991a99e70c8e8033b09a6088a93a0293552c7e59cf99047b62fa45d756135",
  "review_run_sha256": "0a9a8bffaebf6437e829b24991b6958379d7c691880d688178c337f4b8b1bd42"
}
